{"schema_version":"1","source_report_id":"report-001","source_report_digest":"sha256:dddddddddddddddddddddddddddddddddddddddddddddddddddddddddddddddd","selected_statement_ids":["obs-001"],"selected_statement_digests":[{"statement_id":"obs-001","statement_digest":"sha256:eeeeeeeeeeeeeeeeeeeeeeeeeeeeeeeeeeeeeeeeeeeeeeeeeeeeeeeeeeeeeeee"}],"omitted_statement_ids":[],"management_view_digest":"sha256:ffffffffffffffffffffffffffffffffffffffffffffffffffffffffffffffff"}
